{
  "id": "social-media-agent",
  "name": "Social Media Agent Pack",
  "version": "0.1.0",
  "description": "Workflows for agents that need X/Twitter search, social listening, trend checks, and approval-gated account actions through Hermes Agent.",
  "license": "Apache-2.0",
  "maintainers": [
    "Xquik-dev"
  ],
  "stability": "experimental",
  "lastVerified": "2026-06-22",
  "reviewStatus": "draft",
  "tags": [
    "social-media",
    "twitter",
    "x",
    "hermes-agent",
    "xquik",
    "approval-gated"
  ],
  "skills": [
    {
      "id": "hermes-tweet",
      "name": "Hermes Tweet",
      "source": "https://github.com/Xquik-dev/hermes-tweet/tree/master/skills/hermes-tweet",
      "format": "agent-skill",
      "entry": "SKILL.md",
      "version": "0.1.6",
      "homepage": "https://github.com/Xquik-dev/hermes-tweet#readme",
      "repository": "https://github.com/Xquik-dev/hermes-tweet",
      "license": "MIT",
      "trust": "community"
    }
  ],
  "categories": [
    "platform",
    "product"
  ],
  "tools": [
    "hermes-agent",
    "codex",
    "claude-code"
  ],
  "scope": [
    "global",
    "project"
  ]
}
